{
  "protocolVersion": 1,
  "sessionId": "sess_01",
  "runId": "run_01",
  "type": "question_request",
  "timestamp": "2026-05-18T08:00:02.000Z",
  "payload": {
    "requestId": "ques_01",
    "questions": [
      {
        "question": "Which test target should run?",
        "header": "Target",
        "multiSelect": false,
        "options": [
          {
            "label": "Unit",
            "description": "Run unit tests"
          },
          {
            "label": "All",
            "description": "Run every test"
          }
        ]
      }
    ]
  }
}
